created_utc,title,url,Date
1590245618,"Wall Street Week Ahead for the trading week beginning May 25th, 2020",https://www.reddit.com/r/wallstreetbets/comments/gp688k/wall_street_week_ahead_for_the_trading_week/,2020-05-23 14:53:38
1590218775,"Finally I earned my gain, with High leverage Dow jones scalping.",https://www.reddit.com/r/wallstreetbets/comments/gp0t5b/finally_i_earned_my_gain_with_high_leverage_dow/,2020-05-23 07:26:15
1590151280,Previous Presidents and the Dow Jones performance. Will Trump touch paths with Clinton or Hoover?,https://i.redd.it/hffzzpjm9b051.png,2020-05-22 12:41:20
1589756659,Dow Jones micro predictions,http://www.thedowcast.com/astrology-chart-referencing-for-dow-jones.html,2020-05-17 23:04:19
1589733056,"The Normie Playbook: Dollars, Straw, and a Crisis",https://www.reddit.com/r/wallstreetbets/comments/glidmx/the_normie_playbook_dollars_straw_and_a_crisis/,2020-05-17 16:30:56
1589557490,DD: Dow Jones literally showing us the middle finger,https://i.redd.it/gv7x05zy8yy41.jpg,2020-05-15 15:44:50
1589476252,Summary of Ray Dalio’s “Template for Understanding Big Debt Crises” between 1928-1937 with a comparison of 2020,https://www.reddit.com/r/wallstreetbets/comments/gjqhnl/summary_of_ray_dalios_template_for_understanding/,2020-05-14 17:10:52
1589168853,Stock Market Bot,https://www.reddit.com/r/wallstreetbets/comments/ghg5qu/stock_market_bot/,2020-05-11 03:47:33
1589096690,Dow Jones Only Goes Up,https://v.redd.it/rqtaqi3z5wx41,2020-05-10 07:44:50
1589054760,"Wall Street Week Ahead for the trading week beginning May 11th, 2020",https://www.reddit.com/r/wallstreetbets/comments/ggmle1/wall_street_week_ahead_for_the_trading_week/,2020-05-09 20:06:00
1589002160,The new age of Monetary Policy: an in-depth analysis of Federal Reserve Policy in the 2008 and 2020 financial crises,https://www.reddit.com/r/wallstreetbets/comments/gg9lag/the_new_age_of_monetary_policy_an_indepth/,2020-05-09 05:29:20
1588967053,A few thoughts as to where we are in this crazy world.,https://www.reddit.com/r/wallstreetbets/comments/gg03or/a_few_thoughts_as_to_where_we_are_in_this_crazy/,2020-05-08 19:44:13
1588800987,You are living in the greatest con of all time. An explanation of how this market is rigged and tied to Corona,https://www.reddit.com/r/wallstreetbets/comments/get5pu/you_are_living_in_the_greatest_con_of_all_time_an/,2020-05-06 21:36:27
1588793741,"Dow Jones, Data, Due Diligence and Autist Bucks. (QBTC-U.TO)",https://v.redd.it/i412m4gm57x41,2020-05-06 19:35:41
1588733080,(SOUND ON) JPOW Hits the Streets to Get THE DOW JONES UP!,https://v.redd.it/7d708pee52x41,2020-05-06 02:44:40
1588730167,Be prepared for sensational news.,https://www.reddit.com/r/wallstreetbets/comments/geb2lz/be_prepared_for_sensational_news/,2020-05-06 01:56:07
1588286658,Hello,https://www.reddit.com/r/wallstreetbets/comments/gb647v/hello/,2020-04-30 22:44:18
1588283916,Is Wall Street Scizo?? (Serious),https://www.reddit.com/r/wallstreetbets/comments/gb59h8/is_wall_street_scizo_serious/,2020-04-30 21:58:36
1588235650,Past Thursday Unemployment Pumps on one detailed MS Paint Drawing,https://www.reddit.com/r/wallstreetbets/comments/garvud/past_thursday_unemployment_pumps_on_one_detailed/,2020-04-30 08:34:10
1588094979,Musk: winning,https://www.reddit.com/r/wallstreetbets/comments/g9rj4d/musk_winning/,2020-04-28 17:29:39
1588011189,How is the Fed fucking my puts? Read in Vinnie's voice.,https://www.reddit.com/r/wallstreetbets/comments/g96289/how_is_the_fed_fucking_my_puts_read_in_vinnies/,2020-04-27 18:13:09
1587862619,"Start of the discent this week? In the 4th week of April 1930 the Dow Jones started its next wave much lower. I'm just pointing out history, not forecasting with history. Know the difference, but keep things in mind... How are you playing the week?",https://i.redd.it/c5huml7a92v41.png,2020-04-26 00:56:59
1587857056,I had a dream where a mystery voice told me to go long on $SPY Puts.,https://www.reddit.com/r/wallstreetbets/comments/g83mqi/i_had_a_dream_where_a_mystery_voice_told_me_to_go/,2020-04-25 23:24:16
1587823275,"Wall Street Week Ahead for the trading week beginning April 27th, 2020",https://www.reddit.com/r/wallstreetbets/comments/g7tz2d/wall_street_week_ahead_for_the_trading_week/,2020-04-25 14:01:15
1587820382,A hypothesis that the Federal Reserve can set interest rates based on the movements of the planet Mars. Here I have data going back to 1896 that shows how the Dow Jones performed when Mars was within 30 degrees of the lunar node. (- from appendix of Ares Le Mandat 4th ed),https://figshare.com/articles/A_hypothesis_that_the_Federal_Reserve_can_set_interest_rates_based_on_the_movements_of_the_planet_Mars_Here_I_have_data_going_back_to_1896_that_shows_how_the_Dow_Jones_performed_when_Mars_was_within_30_degrees_of_the_lunar_node_/11985924,2020-04-25 13:13:02
1587779085,"Breaking News: The Dow Jones Industrial Average gained 260 points as investors felt confident that the ""disinfectant"" cure proposed by President Trump will make a huge breakthrough to overcome the COVID-19 crisis",https://www.reddit.com/r/wallstreetbets/comments/g7l6ib/breaking_news_the_dow_jones_industrial_average/,2020-04-25 01:44:45
1587762949,"Breaking News: The Dow Jones gained 260 points on Friday as investors felt confident that ""disinfectant"" cure proposed by Donald Trump will make a huge scientific breakthrough during the COVID-19 crisis",https://i.redd.it/741kxufs0uu41.jpg,2020-04-24 21:15:49
1587567568,Dow jones &amp; resistance,https://www.reddit.com/r/wallstreetbets/comments/g62mc0/dow_jones_resistance/,2020-04-22 14:59:28
1587551994,SAME PATTERN IS HAPPENING FROM 1929 and 2008! COINCIDENCE?,https://www.reddit.com/r/wallstreetbets/comments/g5yuk6/same_pattern_is_happening_from_1929_and_2008/,2020-04-22 10:39:54
1587299530,What do you think DOW JONES will be around by the last day of this year?,https://www.reddit.com/r/wallstreetbets/comments/g46x4h/what_do_you_think_dow_jones_will_be_around_by_the/,2020-04-19 12:32:10
1587177974,This Weeks News &amp; Current Events,https://www.reddit.com/r/wallstreetbets/comments/g3g4ae/this_weeks_news_current_events/,2020-04-18 02:46:14
1586960986,[R] A hypothesis that the Federal Reserve can set interest rates based on the movements of the planet Mars. Here I have data going back to 1896 that shows how the Dow Jones performed when Mars was within 30 degrees of the lunar node. (- from appendix of Ares Le Mandat 4th ed),/r/StockMarket/comments/g1qo73/r_a_hypothesis_that_the_federal_reserve_can_set/,2020-04-15 14:29:46
1586896059,Dow Jones Diamond ETF,https://www.reddit.com/r/wallstreetbets/comments/g1d7ol/dow_jones_diamond_etf/,2020-04-14 20:27:39
1586889403,Virgin Galactic Stock Soars Because Covid-19 Can’t Hurt Companies With No Sales,https://www.reddit.com/r/wallstreetbets/comments/g1b49x/virgin_galactic_stock_soars_because_covid19_cant/,2020-04-14 18:36:43
1586801762,SEC Steps in to Help Private Equity BDCs,https://www.reddit.com/r/wallstreetbets/comments/g0oeze/sec_steps_in_to_help_private_equity_bdcs/,2020-04-13 18:16:02
1586621102,A hypothesis that the Federal Reserve can set interest rates based on the movements of the planet Mars. Here I have data going back to 1896 that shows how the Dow Jones performed when Mars was within 30 degrees of the lunar node. (- from appendix of Ares Le Mandat 4th ed),https://www.reddit.com/r/wallstreetbets/comments/fz8b9k/a_hypothesis_that_the_federal_reserve_can_set/,2020-04-11 16:05:02
1586533838,SPY ETF Reschedules Quarterly Rebalancing from April 17 to June,https://www.reddit.com/r/wallstreetbets/comments/fyicgy/spy_etf_reschedules_quarterly_rebalancing_from/,2020-04-10 15:50:38
1586525299,June 19th Rebalancing (SPY + other ETFs),https://www.reddit.com/r/wallstreetbets/comments/fyfuam/june_19th_rebalancing_spy_other_etfs/,2020-04-10 13:28:19
1586436428,"Today's Pre-Market Movers &amp; News [Thursday, April 9th, 2020]",https://www.reddit.com/r/wallstreetbets/comments/fxrsyc/todays_premarket_movers_news_thursday_april_9th/,2020-04-09 12:47:08
1586368451,Dow Jones CEO Will Lewis to step down: FT,https://apple.news/AgKkwbitzRFyIVQw6zxDqNA,2020-04-08 17:54:11
1586262995,"Today's Pre-Market Movers &amp; News [Tuesday, April 7th, 2020]",https://www.reddit.com/r/wallstreetbets/comments/fwjrio/todays_premarket_movers_news_tuesday_april_7th/,2020-04-07 12:36:35
1586139945,Bear confirmation bias,https://www.reddit.com/r/wallstreetbets/comments/fvqgbt/bear_confirmation_bias/,2020-04-06 02:25:45
1585896061,Edward Kholodenko framed OJ,https://www.reddit.com/r/wallstreetbets/comments/fu3e4y/edward_kholodenko_framed_oj/,2020-04-03 06:41:01
1585830502,"Today's Pre-Market Movers &amp; News [Thursday, April 2nd, 2020]",https://www.reddit.com/r/wallstreetbets/comments/ftlh89/todays_premarket_movers_news_thursday_april_2nd/,2020-04-02 12:28:22
1585743614,"Today's Pre-Market Movers &amp; News [Wednesday, April 1st, 2020]",https://www.reddit.com/r/wallstreetbets/comments/fsypwh/todays_premarket_movers_news_wednesday_april_1st/,2020-04-01 12:20:14
1585711563,Any Limit to Unlimited?,https://www.reddit.com/r/wallstreetbets/comments/fsrpk4/any_limit_to_unlimited/,2020-04-01 03:26:03
1585658025,"Today's Pre-Market Movers &amp; News [Tuesday, March 31st, 2020]",https://www.reddit.com/r/wallstreetbets/comments/fsc44p/todays_premarket_movers_news_tuesday_march_31st/,2020-03-31 12:33:45
1585657879,"Today's Pre-Market Movers &amp; News [Tuesday, March 31st, 2020]",https://www.reddit.com/r/wallstreetbets/comments/fsc2yj/todays_premarket_movers_news_tuesday_march_31st/,2020-03-31 12:31:19
1585600479,Dow Jones Predictions for the week,https://www.reddit.com/r/wallstreetbets/comments/fryox6/dow_jones_predictions_for_the_week/,2020-03-30 20:34:39
1585571292,"Today's Pre-Market Movers &amp; News [Monday, March 30th, 2020]",https://www.reddit.com/r/wallstreetbets/comments/frpvsu/todays_premarket_movers_news_monday_march_30th/,2020-03-30 12:28:12
1585449124,Can I call on DAX:Dow Jones ratio?,https://www.reddit.com/r/wallstreetbets/comments/fqy52o/can_i_call_on_daxdow_jones_ratio/,2020-03-29 02:32:04
1585406385,"Wall Street Week Ahead for the trading week beginning March 30th, 2020",https://www.reddit.com/r/wallstreetbets/comments/fqldcx/wall_street_week_ahead_for_the_trading_week/,2020-03-28 14:39:45
1585379037,Powell doesn't need to save the economy to stop your puts from printing,https://www.reddit.com/r/wallstreetbets/comments/fqfaek/powell_doesnt_need_to_save_the_economy_to_stop/,2020-03-28 07:03:57
1585369549,Why SPY and not DIA?,https://www.reddit.com/r/wallstreetbets/comments/fqd9nm/why_spy_and_not_dia/,2020-03-28 04:25:49
1585313015,"Today's Pre-Market Movers &amp; News [Friday, March 27th, 2020]",https://www.reddit.com/r/wallstreetbets/comments/fpwadk/todays_premarket_movers_news_friday_march_27th/,2020-03-27 12:43:35
1585251864,Yo who tf is this “Dow Jones” guy anyway?,https://www.reddit.com/r/wallstreetbets/comments/fpi6lj/yo_who_tf_is_this_dow_jones_guy_anyway/,2020-03-26 19:44:24
1585158979,The Dow Jones is 2.5% away from starting a new bull market.,https://www.reddit.com/r/wallstreetbets/comments/fouths/the_dow_jones_is_25_away_from_starting_a_new_bull/,2020-03-25 17:56:19
1585138731,"Today's Stock Market News [Wednesday, March 25th, 2020]",https://www.reddit.com/r/wallstreetbets/comments/fopbri/todays_stock_market_news_wednesday_march_25th_2020/,2020-03-25 12:18:51
1585086446,"DEJA VU on Monday, Oct.13, 2008 ---&gt; Dow Jones +++ 11.08% +++",https://www.reddit.com/r/wallstreetbets/comments/fodxwx/deja_vu_on_monday_oct13_2008_dow_jones_1108/,2020-03-24 21:47:26
1585059617,Bippity BOPPITY give me the zoppity!,https://www.reddit.com/r/wallstreetbets/comments/fo5vm5/bippity_boppity_give_me_the_zoppity/,2020-03-24 14:20:17
1584971023,"Trade responsibly,",https://www.reddit.com/r/wallstreetbets/comments/fnk6js/trade_responsibly/,2020-03-23 13:43:43
1584950693,Dow Jones Set for a Disastrous Week as Coronavirus Relief Package Hits Roadblock,https://bitcoinethereumnews.com/economy/dow-jones-set-for-a-disastrous-week-as-coronavirus-relief-package-hits-roadblock-economy-news/,2020-03-23 08:04:53
1584919144,"[OC] ""Coronavirus"" Google Trends vs. Dow Jones",https://i.redd.it/sz1dyg9o4bo41.png,2020-03-22 23:19:04
1584861969,[TINFOIL - Was This A Long-Played Attacked w/ Unexpected Pandemic Assistance?] Was going through old posts and found where I fucked up and posted on r/investing... never got a real answer - re-posting here for professional &amp; expert feedback.,https://www.reddit.com/r/wallstreetbets/comments/fmw146/tinfoil_was_this_a_longplayed_attacked_w/,2020-03-22 07:26:09
1584847120,Puts on SPY (Graphs and shit),https://www.reddit.com/r/wallstreetbets/comments/fmsyun/puts_on_spy_graphs_and_shit/,2020-03-22 03:18:40
1584805216,"Wall Street Week Ahead for the trading week beginning March 23rd, 2020",https://www.reddit.com/r/wallstreetbets/comments/fmguae/wall_street_week_ahead_for_the_trading_week/,2020-03-21 15:40:16
1584794335,F for the Dow Jones,https://v.redd.it/a2mll4i8omn41,2020-03-21 12:38:55
1584769602,Inflation Incoming,https://www.reddit.com/r/wallstreetbets/comments/fma9e3/inflation_incoming/,2020-03-21 05:46:42
1584747549,"Dow Jones Target Price: 17,400 - the price just as Trump Got Elected - We can do it. Collapse the economy COVID-19!",http://i2.cdn.turner.com/money/dam/assets/161109122845-election-night-freakout-stocks-780x439.jpg,2020-03-20 23:39:09
1584743819,3 Reasons Dow Jones' Sudden Recovery Stinks of a Dead Cat Bounce: 1) The Dow Jones rising from stimulus is not positive; 2) Record high outflows from investment firms; 3) Coronavirus is showing no signs of slowing down,https://www.ccn.com/3-reasons-dow-jones-500-point-jump-stinks-of-a-dead-cat-bounce/,2020-03-20 22:36:59
1584711705,"Trade responsibly,",https://www.reddit.com/r/wallstreetbets/comments/flv7xb/trade_responsibly/,2020-03-20 13:41:45
1584641216,F for the Dow Jones,https://v.redd.it/a2mll4i8omn41,2020-03-19 18:06:56
1584625669,"Good luck today,",https://www.reddit.com/r/wallstreetbets/comments/flaaks/good_luck_today/,2020-03-19 13:47:49
1584554986,Dow Jones just broke 20k!!,https://www.reddit.com/r/wallstreetbets/comments/fku4d9/dow_jones_just_broke_20k/,2020-03-18 18:09:46
1584551234,"Trading temporarily halted as markets plummet; Dow Jones has dropped from record high of 29,551 to 19,576 now, erasing one-third of its value.",https://abcnews.go.com/Business/futures-dow-opening-plunge-800-points/story?id=69661006,2020-03-18 17:07:14
1584546319,Why is Dow Jones fallling?,https://www.reddit.com/r/wallstreetbets/comments/fkrll9/why_is_dow_jones_fallling/,2020-03-18 15:45:19
1584458687,Leveraged ETF broken?,https://www.reddit.com/r/wallstreetbets/comments/fk735t/leveraged_etf_broken/,2020-03-17 15:24:47
1584409093,DOW Jones jumps +#### Bears:,https://v.redd.it/yvkvjvbhz4n41,2020-03-17 01:38:13
1584388004,"Dow jones has to go lower than 18.000. This is just the start of all shit happening. I cant see how its gonna flatout/acend anytime soon. Corona penetrates the company i owns ass, deep.",https://www.reddit.com/r/wallstreetbets/comments/fjr39k/dow_jones_has_to_go_lower_than_18000_this_is_just/,2020-03-16 19:46:44
1584354553,Time To Straddle,https://www.reddit.com/r/wallstreetbets/comments/fjiuol/time_to_straddle/,2020-03-16 10:29:13
1584320155,No Fed meeting this week! It's going to be a while ride to SPY 200!,https://www.reddit.com/r/wallstreetbets/comments/fjc5u3/no_fed_meeting_this_week_its_going_to_be_a_while/,2020-03-16 00:55:55
1584202541,"Wall Street Week Ahead for the trading week beginning March 16th, 2020",https://www.reddit.com/r/wallstreetbets/comments/fiksw6/wall_street_week_ahead_for_the_trading_week/,2020-03-14 16:15:41
1584070697,Perspective,https://www.reddit.com/r/wallstreetbets/comments/fhtfaq/perspective/,2020-03-13 03:38:17
1584052548,Table of Dow Jones closes for the crashes of 1929/1987/2020,https://www.reddit.com/r/wallstreetbets/comments/fhp33c/table_of_dow_jones_closes_for_the_crashes_of/,2020-03-12 22:35:48
1584044360,"Dow Jones Futures are predicted to be down -2,400+ tomorrow.",https://www.reddit.com/r/wallstreetbets/comments/fhmtz4/dow_jones_futures_are_predicted_to_be_down_2400/,2020-03-12 20:19:20
1584035434,Largest one-day point losses of the Dow Jones Index from 1897 to March 2020 [GRAPH],https://www.reddit.com/r/wallstreetbets/comments/fhkdxn/largest_oneday_point_losses_of_the_dow_jones/,2020-03-12 17:50:34
1584025406,Wallstreetbets' All-Star Anthem,https://www.reddit.com/r/wallstreetbets/comments/fhhoxc/wallstreetbets_allstar_anthem/,2020-03-12 15:03:26
1583980995,Dow Jones movie,https://www.reddit.com/r/wallstreetbets/comments/fh9f6l/dow_jones_movie/,2020-03-12 02:43:15
1583973572,Has Dow=Jones Index Broken A Key Support Trend?,https://www.reddit.com/r/wallstreetbets/comments/fh7new/has_dowjones_index_broken_a_key_support_trend/,2020-03-12 00:39:32
1583963161,That Dow Jones feels,https://i.redd.it/i550wmu664m41.jpg,2020-03-11 21:46:01
1583957539,Dow Jones Industrial Average’s 11-Year Bull Run Ends,https://www.wsj.com/articles/global-markets-calmer-after-two-hectic-days-11583899913,2020-03-11 20:12:19
1583883563,Dow Jones hit a huge and tremendous once in a lifetime milestone today!,https://twitter.com/realdonaldtrump/status/1090729920760893441?lang=en,2020-03-10 23:39:23
1583881501,It's me - the CEO of the Dow Jones,https://www.reddit.com/r/wallstreetbets/comments/fgn09c/its_me_the_ceo_of_the_dow_jones/,2020-03-10 23:05:01
1583804936,Prediction: Dow Jones will be renamed Down Jones by end of 2020,https://www.reddit.com/r/wallstreetbets/comments/fg6642/prediction_dow_jones_will_be_renamed_down_jones/,2020-03-10 01:48:56
1583762453,The Dow Jones just hit a “circuit breaker“ when we dropped 7%. Trading halts for 15 minutes. This is to prevent too quick of a selloff. It was instituted in 1987 after the largest percentage drop in stock history. If it gets worse today they might close the stock market for the rest of the day.,https://i.redd.it/w90w1dsdlnl41.jpg,2020-03-09 14:00:53
1583588782,"Wall Street Week Ahead for the trading week beginning March 9th, 2020",https://www.reddit.com/r/wallstreetbets/comments/fevbei/wall_street_week_ahead_for_the_trading_week/,2020-03-07 13:46:22
1583443532,"Let's show bloomberg our potential to manipulate the market. Let's pump Dow Jones by 420,69 points tomorrow, 6 march.",https://www.reddit.com/r/wallstreetbets/comments/fe2ema/lets_show_bloomberg_our_potential_to_manipulate/,2020-03-05 21:25:32
1583269185,Why the rate cuts won’t stop the beer virus bears,https://www.reddit.com/r/wallstreetbets/comments/fd1eo9/why_the_rate_cuts_wont_stop_the_beer_virus_bears/,2020-03-03 20:59:45
1582955699,"Hey guys, 🌈🐻 here with a quick question...",https://www.reddit.com/r/wallstreetbets/comments/fb88zo/hey_guys_here_with_a_quick_question/,2020-02-29 05:54:59
1582908917,Annual Dow 25k Block Party Thread 🎉,https://www.reddit.com/r/wallstreetbets/comments/faxomy/annual_dow_25k_block_party_thread/,2020-02-28 16:55:17
1582900758,"All you autists are pushing rookie losses at 80-90%, you need to get on the DOW JONES level",https://i.redd.it/mi32del4foj41.jpg,2020-02-28 14:39:18
1582865912,Manipulating Markets,https://www.reddit.com/r/wallstreetbets/comments/fapgss/manipulating_markets/,2020-02-28 04:58:32
1582856966,Dow Jones getting higher and higher from Australia. BUY BUY BUY!,https://i.imgur.com/r845JN7.jpg,2020-02-28 02:29:26
1582853077,A vigil for Dow Jones,https://www.reddit.com/r/wallstreetbets/comments/fampbo/a_vigil_for_dow_jones/,2020-02-28 01:24:37
1582845757,Dow Jones Drops More Points Than Any Day In History,https://www.reddit.com/r/wallstreetbets/comments/fal0q3/dow_jones_drops_more_points_than_any_day_in/,2020-02-27 23:22:37
1582840409,Since bets in the market are shit anyone wanna take bets on how far this big boy is gonna fall?,https://www.reddit.com/r/wallstreetbets/comments/fajox0/since_bets_in_the_market_are_shit_anyone_wanna/,2020-02-27 21:53:29
1582826365,For anyone wondering why dow Jones is climbing back up,https://www.reddit.com/r/wallstreetbets/comments/fag0e0/for_anyone_wondering_why_dow_jones_is_climbing/,2020-02-27 17:59:25
1582820605,DOW JONES is looking like a penny stock today with all this volatility,https://www.reddit.com/r/wallstreetbets/comments/faejlr/dow_jones_is_looking_like_a_penny_stock_today/,2020-02-27 16:23:25
1582697388,BYND and SBUX sign deal,https://www.reddit.com/r/wallstreetbets/comments/f9ouf5/bynd_and_sbux_sign_deal/,2020-02-26 06:09:48
1582554228,Hope for Tuesday?,https://www.reddit.com/r/wallstreetbets/comments/f8rwr9/hope_for_tuesday/,2020-02-24 14:23:48
1582387508,"listen up 🌈🐻, stocks literally ONLY GO 🆙",https://www.reddit.com/r/wallstreetbets/comments/f7ufzt/listen_up_stocks_literally_only_go/,2020-02-22 16:05:08
1582201806,Morgan Stanley reportedly to buy E-Trade for $13 billion,https://www.reddit.com/r/wallstreetbets/comments/f6sdtu/morgan_stanley_reportedly_to_buy_etrade_for_13/,2020-02-20 12:30:06
1580516350,"Barron's from 2 weeks ago: The Dow Could Hit 30,000 Five Years Ahead of Schedule. It Won’t Stop There.",https://www.reddit.com/r/wallstreetbets/comments/ewxq13/barrons_from_2_weeks_ago_the_dow_could_hit_30000/,2020-02-01 00:19:10
1580258831,Whipped up some Gay Bear panic DD for you all,https://www.reddit.com/r/wallstreetbets/comments/eveycu/whipped_up_some_gay_bear_panic_dd_for_you_all/,2020-01-29 00:47:11
1579900322,The year is 2023 The coronavirus has wiped out humankind ...,https://www.reddit.com/r/wallstreetbets/comments/etgp28/the_year_is_2023_the_coronavirus_has_wiped_out/,2020-01-24 21:12:02
1578755551,"Wall Street Week Ahead for the trading week beginning January 13th, 2020",https://www.reddit.com/r/wallstreetbets/comments/en8j9v/wall_street_week_ahead_for_the_trading_week/,2020-01-11 15:12:31
1577652874,"Statistics over the past 70 years hold true, next year is likely to produce healthy, if not stellar, gains.",https://www.reddit.com/r/wallstreetbets/comments/ehbd3n/statistics_over_the_past_70_years_hold_true_next/,2019-12-29 20:54:34
1576168677,NYSE:CCWOF halted trading this morning....,https://www.reddit.com/r/wallstreetbets/comments/e9px9g/nyseccwof_halted_trading_this_morning/,2019-12-12 16:37:57
1576047615,Who is Dow Jones,https://www.reddit.com/r/wallstreetbets/comments/e93p87/who_is_dow_jones/,2019-12-11 07:00:15
1575814378,What could impact the Dow Jones this week? https://marketrealist.com/2019/12/dow-jones-faces-several-litmus-tests-next-week/,https://www.reddit.com/r/wallstreetbets/comments/e7u4yl/what_could_impact_the_dow_jones_this_week/,2019-12-08 14:12:58
1575648152,WSB is putting money managers out of business,https://www.reddit.com/r/wallstreetbets/comments/e70m93/wsb_is_putting_money_managers_out_of_business/,2019-12-06 16:02:32
1575469684,A year back Trump called himself a Tariff Man. He still is! https://marketrealist.com/2019/12/dow-jones-needed-santa-got-tariff-man-instead/,https://www.reddit.com/r/wallstreetbets/comments/e5zzv9/a_year_back_trump_called_himself_a_tariff_man_he/,2019-12-04 14:28:04
1574526316,"Wall Street Week Ahead for the trading week beginning November 25th, 2019",https://www.reddit.com/r/wallstreetbets/comments/e0k1dt/wall_street_week_ahead_for_the_trading_week/,2019-11-23 16:25:16
1573504939,T-Mobile shares slide 3% as Dow Jones reports that CEO John Legere is in talks to become the new CEO of WeWork,https://www.reddit.com/r/wallstreetbets/comments/duymv5/tmobile_shares_slide_3_as_dow_jones_reports_that/,2019-11-11 20:42:19
1572048227,Mornin Breifin (10/25/2019),https://www.reddit.com/r/wallstreetbets/comments/dn65i2/mornin_breifin_10252019/,2019-10-26 00:03:47
1572009680,Morning Briefing (10/25/2019),https://www.reddit.com/r/wallstreetbets/comments/dmxdgj/morning_briefing_10252019/,2019-10-25 13:21:20
1571499157,"Wall Street Week Ahead for the trading week beginning October 21st, 2019",https://www.reddit.com/r/wallstreetbets/comments/dk59js/wall_street_week_ahead_for_the_trading_week/,2019-10-19 15:32:37
1571149052,Anyone playing WWR?,https://www.reddit.com/r/wallstreetbets/comments/di8ji0/anyone_playing_wwr/,2019-10-15 14:17:32
1571058591,Is it gay to jerk off to the Dow Jones?,https://www.reddit.com/r/wallstreetbets/comments/dhqchh/is_it_gay_to_jerk_off_to_the_dow_jones/,2019-10-14 13:09:51
1570993594,Fuck bears! That fly kick going to MOON Dow Jones on Monday. We Bull!,https://twitter.com/HighlandPaddyHK/status/1183285399424126976,2019-10-13 19:06:34
1570111515,Dow Jones Dropping Even Further,https://www.reddit.com/r/wallstreetbets/comments/dcrcxn/dow_jones_dropping_even_further/,2019-10-03 14:05:15
1570034136,"Prune your stocks, Activision Blizzard, Inc. (ATVI), Implied Volatility Index (VIX), SPDR Dow Jones Industrial Average ETF (DIA)",https://youtu.be/4-AhG5NBjtk,2019-10-02 16:35:36
1569534703,Lost 66k shorting the Dow Jones. Bought 202 puts worst decision i have ever made.,https://i.redd.it/ja1uo6sve0p31.png,2019-09-26 21:51:43
1568748222,Options market 9-17-19,https://www.reddit.com/r/wallstreetbets/comments/d5ltow/options_market_91719/,2019-09-17 19:23:42
1568064090,TD Ameritrade Investor Movement Index (IMX) - August 2019,https://www.reddit.com/r/wallstreetbets/comments/d1xbhk/td_ameritrade_investor_movement_index_imx_august/,2019-09-09 21:21:30
1567046570,Trump’s Tweets Cost Investors Over $500 Billion,https://www.reddit.com/r/wallstreetbets/comments/cwux3u/trumps_tweets_cost_investors_over_500_billion/,2019-08-29 02:42:50
1566925795,Afternoon Briefing (8/27/2019),https://www.reddit.com/r/wallstreetbets/comments/cw7dus/afternoon_briefing_8272019/,2019-08-27 17:09:55
1565767080,what in tarnations is this Dow Jones youtube account,https://www.reddit.com/r/wallstreetbets/comments/cq68m0/what_in_tarnations_is_this_dow_jones_youtube/,2019-08-14 07:18:00
