created_utc,title,url,Date
1614393892,GME may have the potential to dictate the course of the entire market. I did some research &amp; analysis.,https://www.reddit.com/r/wallstreetbets/comments/lteecj/gme_may_have_the_potential_to_dictate_the_course/,2021-02-27 02:44:52
1614346424,(2/26) Friday's Pre-Market Stock Movers &amp; News,https://www.reddit.com/r/wallstreetbets/comments/lsxrrn/226_fridays_premarket_stock_movers_news/,2021-02-26 13:33:44
1614277744,"Could GME$ be the new Dow Jones,S&amp;P 500 and NASDAQ",https://www.reddit.com/r/wallstreetbets/comments/lsd9xq/could_gme_be_the_new_dow_jonessp_500_and_nasdaq/,2021-02-25 18:29:04
1614268086,"They say “GMC, AMC, GameStop!” I say... “Dow Jones and Nas”",https://v.redd.it/jl46bd99anj61,2021-02-25 15:48:06
1614215894,Catching back up to the DOW Jones,https://www.reddit.com/r/wallstreetbets/comments/lrt8fb/catching_back_up_to_the_dow_jones/,2021-02-25 01:18:14
1614212957,Dow Jones (US30),https://www.reddit.com/r/wallstreetbets/comments/lrrme1/dow_jones_us30/,2021-02-25 00:29:17
1614211119,"Dow Jones newswire mentions DFV, claims only 39% short interest in GME",https://i.redd.it/vy1bqnewkij61.jpg,2021-02-24 23:58:39
1614192263,Relief Package and Implications for Stock Market,https://www.reddit.com/r/wallstreetbets/comments/lrk5el/relief_package_and_implications_for_stock_market/,2021-02-24 18:44:23
1614088852,(2/23) Tuesday's Pre-Market Stock Movers &amp; News,https://www.reddit.com/r/wallstreetbets/comments/lqj1wm/223_tuesdays_premarket_stock_movers_news/,2021-02-23 14:00:52
1614049755,$2900 profit in 7 days from $5k deposit trading Dow jones only,https://www.reddit.com/r/wallstreetbets/comments/lq7mrk/2900_profit_in_7_days_from_5k_deposit_trading_dow/,2021-02-23 03:09:15
1614008844,Dow Jones Newswires gets it right with headline,https://www.reddit.com/gallery/lprjz9,2021-02-22 15:47:24
1613998468,GameStop Craze Puts Holders of Retail ETF on Wild Ride,https://www.reddit.com/r/wallstreetbets/comments/lpnbt9/gamestop_craze_puts_holders_of_retail_etf_on_wild/,2021-02-22 12:54:28
1613654518,(2/18) Thursday's Pre-Market Stock Movers &amp; News,https://www.reddit.com/r/wallstreetbets/comments/lmmnu7/218_thursdays_premarket_stock_movers_news/,2021-02-18 13:21:58
1613402314,Blame the state lottery because I lost the mortgage money buying scratch tickets...,https://www.reddit.com/r/wallstreetbets/comments/lkfofc/blame_the_state_lottery_because_i_lost_the/,2021-02-15 15:18:34
1613203976,Analysis of the DJ average growth and the sub prime mortgage crisis of 2008 and how the current market isn't overvalued.🖕🌈🐻,https://www.reddit.com/r/wallstreetbets/comments/liwhdb/analysis_of_the_dj_average_growth_and_the_sub/,2021-02-13 08:12:56
1613182986,Will Dow Jones hit 32k first or 31k next week ?,https://www.reddit.com/r/wallstreetbets/comments/lir1ty/will_dow_jones_hit_32k_first_or_31k_next_week/,2021-02-13 02:23:06
1613136398,(2/12) Friday's Pre-Market Stock Movers &amp; News,https://www.reddit.com/r/wallstreetbets/comments/liazjl/212_fridays_premarket_stock_movers_news/,2021-02-12 13:26:38
1613130481,Dow Jones shap fall between 10.15 to 10.45,https://www.reddit.com/r/wallstreetbets/comments/li9hky/dow_jones_shap_fall_between_1015_to_1045/,2021-02-12 11:48:01
1613076029,Dow Jones wants to hire WSB Mods,https://i.redd.it/6hfped4ptwg61.jpg,2021-02-11 20:40:29
1613037097,Thoughts on $CME - potentially undervalued?,https://www.reddit.com/r/wallstreetbets/comments/lhhgyf/thoughts_on_cme_potentially_undervalued/,2021-02-11 09:51:37
1612970775,Dow Jones opens at record levels ahead of Jerome Powell talk,https://www.reddit.com/r/wallstreetbets/comments/lgvz19/dow_jones_opens_at_record_levels_ahead_of_jerome/,2021-02-10 15:26:15
1612970326,Dow Jones (US30) Trading,https://www.reddit.com/r/wallstreetbets/comments/lgvt8s/dow_jones_us30_trading/,2021-02-10 15:18:46
1612964757,(2/10) Wednesday's Pre-Market Stock Movers &amp; News,https://www.reddit.com/r/wallstreetbets/comments/lgtxei/210_wednesdays_premarket_stock_movers_news/,2021-02-10 13:45:57
1612879818,(2/9) Tuesday's Pre-Market Stock Movers &amp; News,https://www.reddit.com/r/wallstreetbets/comments/lg438t/29_tuesdays_premarket_stock_movers_news/,2021-02-09 14:10:18
1612804941,Live streaming my morning 8:00AM GMT and 2:30PM GMT Dax and Dow Jones,https://www.reddit.com/r/wallstreetbets/comments/lfgpot/live_streaming_my_morning_800am_gmt_and_230pm_gmt/,2021-02-08 17:22:21
1612418171,"314.11M Volume on Dow Jones on 2/01, any ideas as to why it's the largest volume in DJI History?",https://www.reddit.com/r/wallstreetbets/comments/lc908r/31411m_volume_on_dow_jones_on_201_any_ideas_as_to/,2021-02-04 05:56:11
1612374567,Probability of Ryan Cohen buying 7% of GME,https://www.reddit.com/r/wallstreetbets/comments/lbte8n/probability_of_ryan_cohen_buying_7_of_gme/,2021-02-03 17:49:27
1612345719,DOW JONES releases GME Short interest as of 3P ET 2/2/2021 is 94.8%,https://i.redd.it/6deqm2fyh8f61.png,2021-02-03 09:48:39
1612303727,"Not an autist, just a retard, but seems as if Dow Jones reporting short interest in GME at 94.8% today",https://i.redd.it/877pwha415f61.jpg,2021-02-02 22:08:47
1612300876,"For the new Apes READ this, if you're illiterate, scroll down to read my sign language",https://www.reddit.com/r/wallstreetbets/comments/lb6rha/for_the_new_apes_read_this_if_youre_illiterate/,2021-02-02 21:21:16
1612300876,"For the new Apes READ this, if you're illiterate, scroll down to read my sign language",https://www.reddit.com/r/wallstreetbets/comments/lb6rg9/for_the_new_apes_read_this_if_youre_illiterate/,2021-02-02 21:21:16
1612299157,"When Dow Jones rises GME and AMC falls, when GME rises Dow Jones falls. The only reason is they want u selling! If we give up now we will lose , if we hold on we will have chance to win . GME to the moon !!!",https://www.reddit.com/r/wallstreetbets/comments/lb63up/when_dow_jones_rises_gme_and_amc_falls_when_gme/,2021-02-02 20:52:37
1612289243,LOVING the lil dow jones editor's pick cherry picking sentences from mcuban's ama replies to make it seem like he is casting doubt over this hold. how stupid do these people think we are,https://i.redd.it/egrvi386u3f61.jpg,2021-02-02 18:07:23
1612266121,Forex Dow jones,https://www.reddit.com/r/wallstreetbets/comments/latpv0/forex_dow_jones/,2021-02-02 11:42:01
1612237842,"No, Dow Jones article, GME is my only interest. I like the stock",https://i.redd.it/i3pkc62clze61.jpg,2021-02-02 03:50:42
1612220704,What’s happening to GME?,https://www.reddit.com/r/wallstreetbets/comments/lagzcz/whats_happening_to_gme/,2021-02-01 23:05:04
1612218955,What’s Happened the Past Few Days?: The Anatomy of a Short Ladder Attack,https://www.reddit.com/r/wallstreetbets/comments/lagb9e/whats_happened_the_past_few_days_the_anatomy_of_a/,2021-02-01 22:35:55
1612218565,"TD ""news"" alert on AMC stock Ticker (clear misinformation tactics)",https://www.reddit.com/r/wallstreetbets/comments/lag5ap/td_news_alert_on_amc_stock_ticker_clear/,2021-02-01 22:29:25
1612212084,New Reports That Half of GME short positions eliminated to day via Dow Jones Newswires.,https://www.reddit.com/r/wallstreetbets/comments/ladiax/new_reports_that_half_of_gme_short_positions/,2021-02-01 20:41:24
1612184950,Stock Market News for Today | Is the Short Squeeze Over? NIO &amp; other Stock Market News [02-01]🚀🚀🚀,https://www.reddit.com/r/wallstreetbets/comments/la2oov/stock_market_news_for_today_is_the_short_squeeze/,2021-02-01 13:09:10
1612179105,Is the GME short squeeze responsible for dow Jones S&amp;P 500 and NYSE losing value ?,https://www.reddit.com/r/wallstreetbets/comments/la13vy/is_the_gme_short_squeeze_responsible_for_dow/,2021-02-01 11:31:45
1612163878,Dow Jones? More like Down Jones 📉 😄,https://www.reddit.com/r/wallstreetbets/comments/l9xiap/dow_jones_more_like_down_jones/,2021-02-01 07:17:58
1612161912,On the 1st February for 15 out of 18 years the Dow Jones raised - today is going to be a very different day. 😅,https://i.redd.it/khtw97qjbte61.jpg,2021-02-01 06:45:12
1612138491,Buy Dow Jones 30,https://www.reddit.com/r/wallstreetbets/comments/l9py6x/buy_dow_jones_30/,2021-02-01 00:14:51
1612093760,Important! GME Short attack tactics predicted in 2014! All the tactics used in the recent week by hedge funds revealed and explained,https://www.reddit.com/r/wallstreetbets/comments/l9auf5/important_gme_short_attack_tactics_predicted_in/,2021-01-31 11:49:20
1612033515,"Dow Jones Futures: What's Next For Stock Market Rally — And What Should You Do? GME Stock, Nio In Focus",https://finance.yahoo.com/m/a670d024-7d05-3d8c-914a-7beeaea77c7f/dow-jones-futures%3A-what%27s.html?src=A00220&amp;yptr=yahoo,2021-01-30 19:05:15
1612023646,A Letter for Monday degenerates! Gamestock is the FIRST SOCIAL INDEX STOCK IN HISTORY!!!! WE CAN BE THE DOW JONES INDEX OF THE LITTLE GUY!! HOLD!!!!DIAMOND HANDS!!!!,https://www.reddit.com/r/wallstreetbets/comments/l8p2bf/a_letter_for_monday_degenerates_gamestock_is_the/,2021-01-30 16:20:46
1611987566,"Dow Jones News' Jason Zweig talking sense. TL;DR ""The retards' activities haven't affected the market as a whole""",https://content.seleritycorp.com/hosted2/assets/www/ecRx2N12BcIp4QGYlkBHLTBAwIW6MdRJf42EpDlLl7A,2021-01-30 06:19:26
1611971081,Long Term Market Implications Due To Current Conditions,https://www.reddit.com/r/wallstreetbets/comments/l8ao3x/long_term_market_implications_due_to_current/,2021-01-30 01:44:41
1611968501,Why Did Robinhood Stop GameStop Trading? Everything to Know. - Barrons.com,https://www.reddit.com/r/wallstreetbets/comments/l89sf0/why_did_robinhood_stop_gamestop_trading/,2021-01-30 01:01:41
1611968114,How Clearing Demands Helped Ground the WallStreetBets Stocks - WSJ article from Robinhood,https://www.reddit.com/r/wallstreetbets/comments/l89ndw/how_clearing_demands_helped_ground_the/,2021-01-30 00:55:14
1611962856,"Dow drops more than 600 points Friday, worst week since October. Looks like a hedge had to sell their stocks to cover the fat losses! LOL! What the fuck is a DOW JONES? I like GME!!! 💎🙌🏼🚀🚀🚀",https://www.reddit.com/r/wallstreetbets/comments/l87q0p/dow_drops_more_than_600_points_friday_worst_week/,2021-01-29 23:27:36
1611950385,EVERYONE NEEDS TO READ THIS,https://www.reddit.com/r/wallstreetbets/comments/l82gnv/everyone_needs_to_read_this/,2021-01-29 19:59:45
1611937053,GME &amp; BlackBerry &amp; Dow Jones (highs and lows for Jan 29th) (graph analysis) 🚀🚀🚀🌙,https://www.reddit.com/r/wallstreetbets/comments/l7wkwb/gme_blackberry_dow_jones_highs_and_lows_for_jan/,2021-01-29 16:17:33
1611936667,"GME &amp; BB &amp; Dow Jones (graph analysis, highs and lows, for today Jan 28th) 🚀🚀🚀🌙",https://www.reddit.com/r/wallstreetbets/comments/l7wez3/gme_bb_dow_jones_graph_analysis_highs_and_lows/,2021-01-29 16:11:07
1611936334,Dow Jones Likes Stonks,https://www.reddit.com/r/wallstreetbets/comments/l7w9sm/dow_jones_likes_stonks/,2021-01-29 16:05:34
1611936231,DFV talks to the Wall Street Journal,https://www.reddit.com/r/wallstreetbets/comments/l7w856/dfv_talks_to_the_wall_street_journal/,2021-01-29 16:03:51
1611929813,"10 Popular Hedge Fund Shorts That Could Get Squeezed Next - AMD, ADI, CMG, DUK, GME - Dow Jones Newswire - Marketwatch",https://www.reddit.com/r/wallstreetbets/comments/l7tkfo/10_popular_hedge_fund_shorts_that_could_get/,2021-01-29 14:16:53
1611928930,1/29 Friday Stock Market Movers &amp; News,https://www.reddit.com/r/wallstreetbets/comments/l7t8lj/129_friday_stock_market_movers_news/,2021-01-29 14:02:10
1611926125,"Let's have a War - F.E.A.R. ""Shake up the Dow Jones """,https://youtu.be/l1HhblSEXoc,2021-01-29 13:15:25
1611923236,Stock Market News for Today | GM / SQ / UBER | The Short Squeeze &amp; other Stock Market News [01-29],https://www.reddit.com/r/wallstreetbets/comments/l7rb4k/stock_market_news_for_today_gm_sq_uber_the_short/,2021-01-29 12:27:16
1611892531,IT'S MR DOW JONES,https://i.redd.it/7ysb9mvj27e61.jpg,2021-01-29 03:55:31
1611865855,Lets short the dow jones and make them all feel the pain! Lets buy SDOW !,https://www.reddit.com/r/wallstreetbets/comments/l77v89/lets_short_the_dow_jones_and_make_them_all_feel/,2021-01-28 20:30:55
1611852518,Ladder Selling Explained,https://www.reddit.com/r/wallstreetbets/comments/l71yxn/ladder_selling_explained/,2021-01-28 16:48:38
1611849168,GameStop-Heavy ETF Shrinks Sharply Amid Redemptions -- Barrons.com,https://www.reddit.com/r/wallstreetbets/comments/l70drl/gamestopheavy_etf_shrinks_sharply_amid/,2021-01-28 15:52:48
1611846258,You brilliant bastards,https://www.reddit.com/r/wallstreetbets/comments/l6yzby/you_brilliant_bastards/,2021-01-28 15:04:18
1611844392,Already seeing articles implying the WSB forum as market manipulators and ignoring the hedge funds/BDs illegal shorting and market manipulation.,https://www.reddit.com/r/wallstreetbets/comments/l6y392/already_seeing_articles_implying_the_wsb_forum_as/,2021-01-28 14:33:12
1611840344,SEC Manipulation Rules and GameStop,https://www.reddit.com/r/wallstreetbets/comments/l6wi4y/sec_manipulation_rules_and_gamestop/,2021-01-28 13:25:44
1611839807,Need explanation,https://www.reddit.com/r/wallstreetbets/comments/l6wbco/need_explanation/,2021-01-28 13:16:47
1611839489,Stock Market News for Today | The Next Stock Market Crash or Buying Opportunity?! AAPL / TSLA [01-28],https://www.reddit.com/r/wallstreetbets/comments/l6w7e1/stock_market_news_for_today_the_next_stock_market/,2021-01-28 13:11:29
1611839334,Stock Market News for Today | The Next Stock Market Crash or Buying Opportunity?! AAPL / TSLA [01-28],https://www.reddit.com/r/wallstreetbets/comments/l6w5mw/stock_market_news_for_today_the_next_stock_market/,2021-01-28 13:08:54
1611837872,We should raise GME price target to when it makes the Dow Jones 30,https://www.reddit.com/r/wallstreetbets/comments/l6vp5c/we_should_raise_gme_price_target_to_when_it_makes/,2021-01-28 12:44:32
1611827123,Dow Jones buy ?,https://www.reddit.com/r/wallstreetbets/comments/l6swmj/dow_jones_buy/,2021-01-28 09:45:23
1611802291,Dow Jones Newswires 01-27-21 1742ET,https://i.redd.it/rvjiwcz7mzd61.jpg,2021-01-28 02:51:31
1611782196,Dow Jones News trying to explain wallstreetbets terminology,https://content.seleritycorp.com/hosted2/assets/www/tE_2kjxzj3rZEq3lBVld0CeI-tRaTzyBmR6xm3l0LwE,2021-01-27 21:16:36
1611782119,"Dow Jones tumbles and suffers it's worst decline since late October of last year, and is on pace for it's longest losing streak since last February.",https://www.reddit.com/r/wallstreetbets/comments/l6ek7s/dow_jones_tumbles_and_suffers_its_worst_decline/,2021-01-27 21:15:19
1611768964,DJ Reddit Says It Will Cooperate With Law Enforcement If Necessary AMC GME,https://www.reddit.com/r/wallstreetbets/comments/l69vgl/dj_reddit_says_it_will_cooperate_with_law/,2021-01-27 17:36:04
1611761005,GameStop stock price target raised to $10 from $1.60 at BofA Securities (MarketWatch) -- (END) Dow Jones Newswires,https://www.barrons.com/articles/gamestop-insiders-sold-stock-before-it-went-vertical-51611760507,2021-01-27 15:23:25
1611760908,GameStop Price Target,https://www.reddit.com/r/wallstreetbets/comments/l66o9b/gamestop_price_target/,2021-01-27 15:21:48
1611666790,Stock Market News for Today [01-26],https://www.reddit.com/r/wallstreetbets/comments/l5dqao/stock_market_news_for_today_0126/,2021-01-26 13:13:10
1611604638,We are under attack by the traditional financial media and it's obvious!,https://www.reddit.com/r/wallstreetbets/comments/l4w0so/we_are_under_attack_by_the_traditional_financial/,2021-01-25 19:57:18
1611604549,We are under attack by the traditional financial media and it's obvious!,https://www.reddit.com/r/wallstreetbets/comments/l4vzmm/we_are_under_attack_by_the_traditional_financial/,2021-01-25 19:55:49
1611600239,Not a good day to be a boomer who invests in DOW Jones,https://www.reddit.com/r/wallstreetbets/comments/l4udfw/not_a_good_day_to_be_a_boomer_who_invests_in_dow/,2021-01-25 18:43:59
1611580730,Mars enters within 30 degrees of the lunar node on Feb 9. Hypothetically the market should begin to drop when that happens,https://www.reddit.com/r/wallstreetbets/comments/l4nowf/mars_enters_within_30_degrees_of_the_lunar_node/,2021-01-25 13:18:50
1611579394,Stock Market News for Today | PLTR / GM / AAPL / TSLA / FB / MSFT &amp; Other Stock Market News [01-25],https://www.reddit.com/r/wallstreetbets/comments/l4nbuw/stock_market_news_for_today_pltr_gm_aapl_tsla_fb/,2021-01-25 12:56:34
1611579305,Stock Market News for Today | PLTR / GM / AAPL / TSLA / FB / MSFT &amp; Other Stock Market News [01-25],https://www.reddit.com/r/wallstreetbets/comments/l4nb2w/stock_market_news_for_today_pltr_gm_aapl_tsla_fb/,2021-01-25 12:55:05
1611447196,"The $BECKY inspired $CUNT index vs the S&amp;P and Dow Jones (Chewy, Nordstrom, Ulta, Target)",https://i.redd.it/40ebqk61a6d61.png,2021-01-24 00:13:16
1611355707,GME: WSB vs Andrew Left,https://www.reddit.com/r/wallstreetbets/comments/l2z4gw/gme_wsb_vs_andrew_left/,2021-01-22 22:48:27
1611322196,How luck plays an important role in the stock market (GME and others),https://www.reddit.com/r/wallstreetbets/comments/l2nqva/how_luck_plays_an_important_role_in_the_stock/,2021-01-22 13:29:56
1611303749,"Stock Market News for Today | Intel [INTC], Tesla [TSLA] &amp; Other Stock Market News [01-22]",https://www.reddit.com/r/wallstreetbets/comments/l2jdle/stock_market_news_for_today_intel_intc_tesla_tsla/,2021-01-22 08:22:29
1611249942,Jack Ma Returns,https://www.reddit.com/r/wallstreetbets/comments/l23285/jack_ma_returns/,2021-01-21 17:25:42
1611233164,"Stock Market News for Today | GM, NetFlix [NFLX], Alibaba [BABA] &amp; Other Stock Market News [01-21]",https://www.reddit.com/r/wallstreetbets/comments/l1xrov/stock_market_news_for_today_gm_netflix_nflx/,2021-01-21 12:46:04
1611122687,Even the big dogs see the short squeeze. They're just trying to scare us to sell GME,https://www.reddit.com/r/wallstreetbets/comments/l136ks/even_the_big_dogs_see_the_short_squeeze_theyre/,2021-01-20 06:04:47
1611110832,Push harder? GME,https://www.reddit.com/r/wallstreetbets/comments/l0zxmu/push_harder_gme/,2021-01-20 02:47:12
1610656726,GME Gang - Made the Dow Jones News Wire on TOS,https://www.reddit.com/r/wallstreetbets/comments/kxe8br/gme_gang_made_the_dow_jones_news_wire_on_tos/,2021-01-14 20:38:46
1610656504,GME - We made the Dow Jones Newswires on TOS,https://www.reddit.com/r/wallstreetbets/comments/kxe5lj/gme_we_made_the_dow_jones_newswires_on_tos/,2021-01-14 20:35:04
1610637070,Dow Jones Micro-Cap Index,https://www.reddit.com/r/wallstreetbets/comments/kx7gg8/dow_jones_microcap_index/,2021-01-14 15:11:10
1610628841,"Stock Market News for Today | GME Squeeze | BABA, INTC, TGT, AFRM &amp; other Stock Market News [01-14]",https://www.reddit.com/r/wallstreetbets/comments/kx52ui/stock_market_news_for_today_gme_squeeze_baba_intc/,2021-01-14 12:54:01
1610570838,🚀🚀🚀🚀🚀GME Squeeze hasn't even Happened yet🚀🚀🚀🚀🚀,https://www.reddit.com/r/wallstreetbets/comments/kwpilt/gme_squeeze_hasnt_even_happened_yet/,2021-01-13 20:47:18
1610570564,$GME Gang - THERE HASN'T BEEN A SHORT SQUEEZE (yet) - Ihor Dusaniwsky,https://www.reddit.com/r/wallstreetbets/comments/kwpf6k/gme_gang_there_hasnt_been_a_short_squeeze_yet/,2021-01-13 20:42:44
1610545864,"Today's Pre-Market Movers &amp; News [Wednesday, January 13th, 2021]",https://www.reddit.com/r/wallstreetbets/comments/kwgsc7/todays_premarket_movers_news_wednesday_january/,2021-01-13 13:51:04
1610542449,Stock Market News for Today | PLUG Power &amp; GM | TSLA vs AAPL| AFRM &amp; other Stock Market News [01-13],https://www.reddit.com/r/wallstreetbets/comments/kwfv18/stock_market_news_for_today_plug_power_gm_tsla_vs/,2021-01-13 12:54:09
1610481745,Short Alert: Trump planning on banning Americans from investing in BABA on way out,https://www.reddit.com/r/wallstreetbets/comments/kvzet8/short_alert_trump_planning_on_banning_americans/,2021-01-12 20:02:25
1610456237,"Stock Market News for Today |LMND, NIO, WMT, JNJ, AFRM IPO &amp; other Stock Market News [01-12]",https://www.reddit.com/r/wallstreetbets/comments/kvr5rk/stock_market_news_for_today_lmnd_nio_wmt_jnj_afrm/,2021-01-12 12:57:17
1610382402,Tesla to be added to DJIA soon,https://www.reddit.com/r/wallstreetbets/comments/kv60pn/tesla_to_be_added_to_djia_soon/,2021-01-11 16:26:42
1610369851,"Stock Market News for Today | NIO Stock News | DKNG, PENN &amp; other Stock Market News [01-11]",https://www.reddit.com/r/wallstreetbets/comments/kv24ap/stock_market_news_for_today_nio_stock_news_dkng/,2021-01-11 12:57:31
1610138590,How to play the market right now,https://www.reddit.com/r/wallstreetbets/comments/ktbb0d/how_to_play_the_market_right_now/,2021-01-08 20:43:10
1610113222,"Today's Pre-Market Movers &amp; News [Friday, January 8th, 2021]",https://www.reddit.com/r/wallstreetbets/comments/kt2mhk/todays_premarket_movers_news_friday_january_8th/,2021-01-08 13:40:22
1610111919,Stock Market News for Today | TSLA vs FB | LMND SPIKES | APPLE CAR &amp; other stock market news [01-08],https://www.reddit.com/r/wallstreetbets/comments/kt2a38/stock_market_news_for_today_tsla_vs_fb_lmnd/,2021-01-08 13:18:39
1610026388,"Today's Pre-Market Movers &amp; News [Thursday, January 7th, 2021]",https://www.reddit.com/r/wallstreetbets/comments/ksdc2n/todays_premarket_movers_news_thursday_january_7th/,2021-01-07 13:33:08
1610024631,"Stock Market News for Today | RUN, ENPH, TLRY, ACB, NIO, ROKU, CAT, F &amp; Other Stock News [01-07]",https://www.reddit.com/r/wallstreetbets/comments/kscunh/stock_market_news_for_today_run_enph_tlry_acb_nio/,2021-01-07 13:03:51
1610024448,"Stock Market News for Today | RUN, ENPH, TLRY, ACB, NIO, ROKU, CAT, F &amp; Other Stock News [01-07]",https://www.reddit.com/r/wallstreetbets/comments/kscsui/stock_market_news_for_today_run_enph_tlry_acb_nio/,2021-01-07 13:00:48
1609943070,"Private payrolls declined by 123,000 in December vs. the Dow Jones estimate for a gain of 60,000.",https://www.cnbc.com/2021/01/06/private-payrolls-decrease-123000-in-december-vs-estimate-for-a-60000-gain-adp-reports.html,2021-01-06 14:24:30
1609939777,Stock Market News for Today | BABA | GM &amp; Other Stock Market News [01-06],https://www.reddit.com/r/wallstreetbets/comments/krnvkz/stock_market_news_for_today_baba_gm_other_stock/,2021-01-06 13:29:37
1609870167,"When Dow Jones is calling, you better pick up",https://i.redd.it/9ime3su01k961.jpg,2021-01-05 18:09:27
1609854308,Stock Market News for Today | Start of the next crash? BILI | QS &amp; Other Stock Market News [01-05],https://www.reddit.com/r/wallstreetbets/comments/kqypyp/stock_market_news_for_today_start_of_the_next/,2021-01-05 13:45:08
1609765891,"Stock Market News for Today | TSLA, NIO, LMND, FUBO, ROKU &amp; Other Stock Market News [01-04]",https://www.reddit.com/r/wallstreetbets/comments/kq8hac/stock_market_news_for_today_tsla_nio_lmnd_fubo/,2021-01-04 13:11:31
1609423054,"Stock Market News for Today | LMT, AAPL, ACB, TLRY, FUBO, ARKK &amp; other stock market news",https://www.reddit.com/r/wallstreetbets/comments/knqfeb/stock_market_news_for_today_lmt_aapl_acb_tlry/,2020-12-31 13:57:34
1609335650,"Stock Market News for Today | INTC, PTON, AAPL, HD, LULU &amp; other stock market updates [12-30]",https://www.reddit.com/r/wallstreetbets/comments/kn2g7f/stock_market_news_for_today_intc_pton_aapl_hd/,2020-12-30 13:40:50
1609244928,"Stock Market News for Today | Fubo, GM, Tesla, Ford, Lemonade, Nikola, JP Morgan &amp;other news [12-29]",https://www.reddit.com/r/wallstreetbets/comments/kmdirq/stock_market_news_for_today_fubo_gm_tesla_ford/,2020-12-29 12:28:48
1609157897,Quick Stock Market News for Today | SP500 / NASDAQ / DOW JONES / ALIBABA [BABA] | [12-28],https://www.reddit.com/r/wallstreetbets/comments/klpjd4/quick_stock_market_news_for_today_sp500_nasdaq/,2020-12-28 12:18:17
1608814532,"Nikola Stock Crash | Alibaba Stock Plunges | FCEL, DKNG &amp; PENN | Stock Market News for Today [12-24]",https://www.reddit.com/r/wallstreetbets/comments/kjezv5/nikola_stock_crash_alibaba_stock_plunges_fcel/,2020-12-24 12:55:32
1608744110,"Buy Corning Shares Because Glass Supplies Are Tightening, Citi Says -- Barrons.com",https://www.reddit.com/r/wallstreetbets/comments/kix4oo/buy_corning_shares_because_glass_supplies_are/,2020-12-23 17:21:50
1608730678,Will Trump Veto the Stimulus? | Direct IPOs | MRNA &amp; BA | Stock Market News for Today [12-23],https://www.reddit.com/r/wallstreetbets/comments/kit85b/will_trump_veto_the_stimulus_direct_ipos_mrna_ba/,2020-12-23 13:37:58
1608680021,Tesla: Not an Automatic Addition to the S&amp;P 500 ESG Index – S&amp;P Dow Jones Indices,https://www.indexologyblog.com/2020/12/22/tesla-not-an-automatic-addition-to-the-sp-500-esg-index/,2020-12-22 23:33:41
1608642852,Stimulus Deal Reached | Apple coming for Tesla? | CarMax Earnings | Stock Market News [12-22],https://www.reddit.com/r/wallstreetbets/comments/ki53t3/stimulus_deal_reached_apple_coming_for_tesla/,2020-12-22 13:14:12
1608556539,Tesla Joins SP500 | Nike Blowout Earnings |Stimulus Deal News| Stock Market News- Crash Today? [12-21],https://www.reddit.com/r/wallstreetbets/comments/khh70q/tesla_joins_sp500_nike_blowout_earnings_stimulus/,2020-12-21 13:15:39
1608060703,BBBY to $50/share?,https://www.reddit.com/r/wallstreetbets/comments/kdskto/bbby_to_50share/,2020-12-15 19:31:43
1608044069,Dow Jones 110.000 +256% according to Europoor's brokers lmao,https://i.redd.it/exi9tf6x6d561.png,2020-12-15 14:54:29
1608039287,Quadruple Witching Stock Day | DASH &amp; ABNB Crash | Apple Stock | Stock Market News Today [12-15],https://www.reddit.com/r/wallstreetbets/comments/kdltgl/quadruple_witching_stock_day_dash_abnb_crash/,2020-12-15 13:34:47
1607694064,Dow Jones selloff has begun,https://i.redd.it/k4afmdb8ak461.png,2020-12-11 13:41:04
1607689858,The Hound of Hounslow (How an Autist Broke the Market),https://www.reddit.com/r/wallstreetbets/comments/kb1vz9/the_hound_of_hounslow_how_an_autist_broke_the/,2020-12-11 12:30:58
