created_utc,title,url,Date
1607606634,"Selling DoorDash after IPO? | AirBNB IPO NEXT | LULU, ADBE, COST, PLAY STOCK EARNINGS | STOCK MARKET NEWS [12-10]",https://www.reddit.com/r/wallstreetbets/comments/kaf70e/selling_doordash_after_ipo_airbnb_ipo_next_lulu/,2020-12-10 13:23:54
1607606538,"Selling DoorDash after IPO? | AirBNB IPO NEXT | LULU, ADBE, COST, PLAY STOCK EARNINGS | STOCK MARKET NEWS [12-09]",https://www.reddit.com/r/wallstreetbets/comments/kaf66r/selling_doordash_after_ipo_airbnb_ipo_next_lulu/,2020-12-10 13:22:18
1607520851,AirBNB &amp; DoorDash IPOs | CHEWY &amp; GameStop EARNINGS | APPLE news| STOCK MARKET NEWS [12-09],https://www.reddit.com/r/wallstreetbets/comments/k9rweq/airbnb_doordash_ipos_chewy_gamestop_earnings/,2020-12-09 13:34:11
1607443834,Why stock market investors predict gains in 2021 | TESLA sells $5B in shares | Stock market news [12-08],https://www.reddit.com/r/wallstreetbets/comments/k96zr8/why_stock_market_investors_predict_gains_in_2021/,2020-12-08 16:10:34
1607437812,TESLA sell $5B in shares | Stock market news | Why stock market investors predict gains in 2021 |[12-08],https://www.reddit.com/r/wallstreetbets/comments/k954t1/tesla_sell_5b_in_shares_stock_market_news_why/,2020-12-08 14:30:12
1607429932,"If you traded this micro Dow Jones algorithm since last November 2019, you would be around +18% instead of -10%. If you didn't use the algorithm at all, you'd only be +8%",https://www.reddit.com/r/wallstreetbets/comments/k937nr/if_you_traded_this_micro_dow_jones_algorithm/,2020-12-08 12:18:52
1607353613,A hypothesis that the Federal Reserve can set interest rates based on the movements of the planet Mars,https://www.reddit.com/r/wallstreetbets/comments/k8i8lw/a_hypothesis_that_the_federal_reserve_can_set/,2020-12-07 15:06:53
1607135241,ATH Party post! SPY and the Dow Jones at ALL TIME MOTHERFUCKING HIGHS FAM!,https://www.reddit.com/r/wallstreetbets/comments/k6z8bo/ath_party_post_spy_and_the_dow_jones_at_all_time/,2020-12-05 02:27:21
1607134619,"Listen retards, CRM should be your major easy-money move next week (fool-proof instructions inside)",https://www.reddit.com/r/wallstreetbets/comments/k6z2fs/listen_retards_crm_should_be_your_major_easymoney/,2020-12-05 02:16:59
1607002599,CROWDSTRIKE |OKTA | SNOWFLAKE |CHINA STOCKS ON THE WATCH| FAANG STOCKS &amp; STOCK MARKET NEWS [12-03],https://www.reddit.com/r/wallstreetbets/comments/k5xbdq/crowdstrike_okta_snowflake_china_stocks_on_the/,2020-12-03 13:36:39
1606862771,"Get your puts ready, who voted him back in?",https://www.reddit.com/r/wallstreetbets/comments/k4w4uu/get_your_puts_ready_who_voted_him_back_in/,2020-12-01 22:46:11
1606778024,TSLA to be added to S&amp;P ALL at once on 12/21/20,https://www.reddit.com/r/wallstreetbets/comments/k47vn0/tsla_to_be_added_to_sp_all_at_once_on_122120/,2020-11-30 23:13:44
1606775729,TSLA S&amp;P News,https://www.reddit.com/r/wallstreetbets/comments/k473l8/tsla_sp_news/,2020-11-30 22:35:29
1606577439,"Wall Street Week Ahead for the trading week beginning November 30th, 2020",https://www.reddit.com/r/wallstreetbets/comments/k2pj9d/wall_street_week_ahead_for_the_trading_week/,2020-11-28 15:30:39
1606338865,"The Stock Market Keeps Rising, but Millennials Aren’t Reaping the Benefits",https://www.reddit.com/r/wallstreetbets/comments/k111ss/the_stock_market_keeps_rising_but_millennials/,2020-11-25 21:14:25
1606333503,PSA: Market closed on 11/26 and closes early 11/27,https://www.reddit.com/r/wallstreetbets/comments/k0zc65/psa_market_closed_on_1126_and_closes_early_1127/,2020-11-25 19:45:03
1606267112,"Stock Market News – Dow Jones Industrial Average Hits 30000, Buy Assets Not Liabilities (11/24/20)",https://www.reddit.com/r/wallstreetbets/comments/k0i7dz/stock_market_news_dow_jones_industrial_average/,2020-11-25 01:18:32
1606266057,"Stock Market News - Dow Jones Industrial Average Hits 30000, Buy Assets Not Liabilities (11/24/20)",https://www.reddit.com/r/wallstreetbets/comments/k0hx9h/stock_market_news_dow_jones_industrial_average/,2020-11-25 01:00:57
1605746443,RED DAY tomorrow 🔴 Unemployment report × all stocks go down especially those who peaked a lot today. Tsla? Dow jones stocks!,https://www.reddit.com/r/wallstreetbets/comments/jwsdvu/red_day_tomorrow_unemployment_report_all_stocks/,2020-11-19 00:40:43
1605626169,TSLA: Points to consider,https://www.reddit.com/r/wallstreetbets/comments/jvupe8/tsla_points_to_consider/,2020-11-17 15:16:09
1605571150,The case for $XOM - Texas tea is back on the menu.,https://www.reddit.com/r/wallstreetbets/comments/jvicfr/the_case_for_xom_texas_tea_is_back_on_the_menu/,2020-11-16 23:59:10
1605536136,A hypothesis that the Federal Reserve can set interest rates based on the movements of the planet Mars. Here I have data going back to 1896,https://www.reddit.com/r/wallstreetbets/comments/jv7fn8/a_hypothesis_that_the_federal_reserve_can_set/,2020-11-16 14:15:36
1605109900,"NIO, XPEV, and LI Report Earnings Soon. Here's What to Expect.",https://www.reddit.com/r/wallstreetbets/comments/jsaj8o/nio_xpev_and_li_report_earnings_soon_heres_what/,2020-11-11 15:51:40
1605105344,A lil morning coffee,https://www.reddit.com/r/wallstreetbets/comments/js96vk/a_lil_morning_coffee/,2020-11-11 14:35:44
1605021747,QQQ looking weak compared to S&amp;P. Dow Jones looks best of the 3. Is this the real rotation out of tech?,https://www.reddit.com/gallery/jrmszs,2020-11-10 15:22:27
1604706725,Volatility is Coming Back: How Election News is Overshadowing Potential Market Turmoil,https://www.reddit.com/r/wallstreetbets/comments/jpgd94/volatility_is_coming_back_how_election_news_is/,2020-11-06 23:52:05
1603911565,"Happy ""Black Monday 1929"" anniversary",https://www.reddit.com/r/wallstreetbets/comments/jjtz56/happy_black_monday_1929_anniversary/,2020-10-28 18:59:25
1603900099,ITS OVER... TENDIES GONE,https://www.reddit.com/r/wallstreetbets/comments/jjq8e8/its_over_tendies_gone/,2020-10-28 15:48:19
1602982534,Can someone explain margin requirement and margin call,https://www.reddit.com/r/wallstreetbets/comments/jd6vp9/can_someone_explain_margin_requirement_and_margin/,2020-10-18 00:55:34
1602944689,TESLA BATTERY DAY SCHEDULE LEAKED!,https://www.reddit.com/r/wallstreetbets/comments/jcw04e/tesla_battery_day_schedule_leaked/,2020-10-17 14:24:49
1602939265,"Wall Street Week Ahead for the trading week beginning October 19th, 2020",https://www.reddit.com/r/wallstreetbets/comments/jcumcj/wall_street_week_ahead_for_the_trading_week/,2020-10-17 12:54:25
1602880516,Market and Options Summary for Oct-16-2020,https://www.reddit.com/r/wallstreetbets/comments/jchqkk/market_and_options_summary_for_oct162020/,2020-10-16 20:35:16
1602791888,our new ayatollah #Smeading #ModCandidate,https://www.reddit.com/r/wallstreetbets/comments/jbv0s1/our_new_ayatollah_smeading_modcandidate/,2020-10-15 19:58:08
1602595090,My names assfuck mcgriddle and I work in computer and the Dow jones is down 🦼,https://v.redd.it/e11vju1f4vs51,2020-10-13 13:18:10
1602560806,I &lt;3 Dow Jones,https://v.redd.it/z0vahmqiass51,2020-10-13 03:46:46
1602079151,Infinite S&amp;P 500 gain hack by President Pump (gay bears are fuk),https://www.reddit.com/r/wallstreetbets/comments/j6rbj5/infinite_sp_500_gain_hack_by_president_pump_gay/,2020-10-07 13:59:11
1602026209,...*What's this?,https://www.reddit.com/r/wallstreetbets/comments/j6fvo6/whats_this/,2020-10-06 23:16:49
1602011882,What happened to Dow Jones? Stroke me like a .....,https://www.reddit.com/r/wallstreetbets/comments/j6bini/what_happened_to_dow_jones_stroke_me_like_a/,2020-10-06 19:18:02
1602011160,What happened to Dow Jones?,https://www.reddit.com/r/wallstreetbets/comments/j6baa0/what_happened_to_dow_jones/,2020-10-06 19:06:00
1602010995,Hello autists,https://www.reddit.com/r/wallstreetbets/comments/j6b8dt/hello_autists/,2020-10-06 19:03:15
1601937690,"Market and Options Summary for October 5th, 2020 -",https://www.reddit.com/r/wallstreetbets/comments/j5tln0/market_and_options_summary_for_october_5th_2020/,2020-10-05 22:41:30
1601884882,Where can I find the Dow Jones Industrial Average chart with micro-intervals of seconds (candlestick)?,https://www.reddit.com/r/wallstreetbets/comments/j5fhcy/where_can_i_find_the_dow_jones_industrial_average/,2020-10-05 08:01:22
1601884363,Where can I find the Dow Jones Industrial Average chart with micro-intervals of seconds (candlestick)?,https://www.reddit.com/r/wallstreetbets/comments/j5fedg/where_can_i_find_the_dow_jones_industrial_average/,2020-10-05 07:52:43
1601627515,I wanna go balls deep with some CFD’s at the open. What’s the Dow Jones gonna do?,https://www.reddit.com/r/wallstreetbets/comments/j3qx31/i_wanna_go_balls_deep_with_some_cfds_at_the_open/,2020-10-02 08:31:55
1601397525,Possible Impending Collapse of the Market,https://www.reddit.com/r/wallstreetbets/comments/j22uyh/possible_impending_collapse_of_the_market/,2020-09-29 16:38:45
1601381125,Decade’s Hottest Stocks Reflect Hunger for Anything Tech,https://www.reddit.com/r/wallstreetbets/comments/j1xx77/decades_hottest_stocks_reflect_hunger_for/,2020-09-29 12:05:25
1600819794,"Daily Market and Options Summary for September 22, 2020 -",https://www.reddit.com/r/wallstreetbets/comments/ixziqv/daily_market_and_options_summary_for_september_22/,2020-09-23 00:09:54
1600729707,"Daily Market and Options Summary for September 21, 2020 -",https://www.reddit.com/r/wallstreetbets/comments/ixbloh/daily_market_and_options_summary_for_september_21/,2020-09-21 23:08:27
1600696754,annual Dow Jones returns vs annual Dow Jones returns without days of Mars within 30 degrees of the lunar node,https://www.reddit.com/r/wallstreetbets/comments/ix0xtq/annual_dow_jones_returns_vs_annual_dow_jones/,2020-09-21 13:59:14
1600695553,annual Dow Jones returns vs annual Dow Jones returns without days of Mars within 30 degrees of the lunar node,https://www.reddit.com/r/wallstreetbets/comments/ix0ldo/annual_dow_jones_returns_vs_annual_dow_jones/,2020-09-21 13:39:13
1600695082,year by year comparison (going back to 1897) between the annual Dow Jones returns vs annual Dow Jones returns that leave out the days that the planet Mars was within 30 degrees of the lunar node,https://www.reddit.com/r/wallstreetbets/comments/ix0gfe/year_by_year_comparison_going_back_to_1897/,2020-09-21 13:31:22
1600692444,year by year comparison (going back to 1897) between the annual Dow Jones returns vs annual Dow Jones returns that leave out the days that the planet Mars was within 30 degrees of the lunar node,https://www.reddit.com/r/wallstreetbets/comments/iwzqng/year_by_year_comparison_going_back_to_1897/,2020-09-21 12:47:24
1600691669,year by year comparison (going back to 1897) between the annual Dow Jones returns vs annual Dow Jones returns that leave out the days that the planet Mars was within 30 degrees of the lunar node,https://www.reddit.com/r/wallstreetbets/comments/iwzjaf/year_by_year_comparison_going_back_to_1897/,2020-09-21 12:34:29
1600690849,A hypothesis that the Federal Reserve can set interest rates based on the movements of the planet Mars. Here I have data going back to 1896 that shows how the Dow Jones performed when Mars was within 30 degrees of the lunar node.,https://www.reddit.com/r/wallstreetbets/comments/iwzbrm/a_hypothesis_that_the_federal_reserve_can_set/,2020-09-21 12:20:49
1600517593,Year by year comparison (going back to 1897) between the annual Dow Jones returns vs annual Dow Jones returns without factoring in the days that the planet Mars was within 30 degrees of the lunar node,https://www.academia.edu/44117787/pp_803_and_804_of_Chapter_52_of_Ares_Le_Mandat_6th_ed_year_by_year_comparison_going_back_to_1897_between_the_annual_Dow_Jones_returns_vs_annual_Dow_Jones_returns_that_leave_out_the_days_that_the_planet_Mars_was_within_30_degrees_of_the_lunar_node,2020-09-19 12:13:13
1600495625,Wanted: Share Buybacks,https://www.reddit.com/r/wallstreetbets/comments/ivn2us/wanted_share_buybacks/,2020-09-19 06:07:05
1600472940,"Daily Market and Options Summary for September 18th, 2020",https://www.reddit.com/r/wallstreetbets/comments/ivhham/daily_market_and_options_summary_for_september/,2020-09-18 23:49:00
1600472621,"Market and Options Summary for September 18, 2020 -",https://www.reddit.com/r/wallstreetbets/comments/ivhe26/market_and_options_summary_for_september_18_2020/,2020-09-18 23:43:41
1600381271,"Daily Market and Options Summary for September 17th, 2020",https://www.reddit.com/r/wallstreetbets/comments/iuts0x/daily_market_and_options_summary_for_september/,2020-09-17 22:21:11
1599794254,DOW Jones Tomorrow,https://images.app.goo.gl/PWrTc3rSBUW6m2Cr5,2020-09-11 03:17:34
1599785745,DOW jones with another 400+ close in the making today,https://www.reddit.com/r/wallstreetbets/comments/iqgesh/dow_jones_with_another_400_close_in_the_making/,2020-09-11 00:55:45
1599772096,"Daily Market and Options Summary for September 10th, 2020",https://www.reddit.com/r/wallstreetbets/comments/iqcdah/daily_market_and_options_summary_for_september/,2020-09-10 21:08:16
1599771310,Extremely high volume - what does it mean?,https://www.reddit.com/r/wallstreetbets/comments/iqc464/extremely_high_volume_what_does_it_mean/,2020-09-10 20:55:10
1599695711,Daily Market and Options Summary for September 9th - 2020,https://www.reddit.com/r/wallstreetbets/comments/ips78f/daily_market_and_options_summary_for_september/,2020-09-09 23:55:11
1599604551,"Market and Options Summary for September 8th, 2020 -",https://www.reddit.com/r/wallstreetbets/comments/ip3sz6/market_and_options_summary_for_september_8th_2020/,2020-09-08 22:35:51
1599423659,Why S&amp;P500 or SPY will go up on Tuesday,https://www.reddit.com/r/wallstreetbets/comments/int6vd/why_sp500_or_spy_will_go_up_on_tuesday/,2020-09-06 20:20:59
1599318605,Turbulent Week for Dow Jones Stocks,https://v.redd.it/jzcpm07lhcl51,2020-09-05 15:10:05
1599317267,How can the nasdaq be worth more that it was before covid?,https://www.reddit.com/r/wallstreetbets/comments/in2brg/how_can_the_nasdaq_be_worth_more_that_it_was/,2020-09-05 14:47:47
1599316185,I'm new to investing and have a question. How can the nasdaq be valued at above its Feb value? And the Dow Jones is around the same as it was then too.,https://www.reddit.com/r/wallstreetbets/comments/in2144/im_new_to_investing_and_have_a_question_how_can/,2020-09-05 14:29:45
1599258394,S&amp;P Dow Jones index are a bunch of soy boy beta cucks. How the fuck do they let in Etsy and not Tesla?,https://i.redd.it/c9u5n2wri7l51.jpg,2020-09-04 22:26:34
1599252380,"Daily Market and Options Summary for September 4th, 2020 -",https://www.reddit.com/r/wallstreetbets/comments/imnymg/daily_market_and_options_summary_for_september/,2020-09-04 20:46:20
1599084348,Donnie Pumps is using emojis now:,https://www.reddit.com/r/wallstreetbets/comments/ilgpnt/donnie_pumps_is_using_emojis_now/,2020-09-02 22:05:48
1599083765,"Donnie Pumps on Twitter: “The Dow Jones Industrial just closed above 29,000! You are so lucky to have me as your President😉With Joe Hiden’ it would crash😧”",https://www.reddit.com/r/wallstreetbets/comments/ilgjcc/donnie_pumps_on_twitter_the_dow_jones_industrial/,2020-09-02 21:56:05
1599083628,"Donnie Pumps On Twitter: “The Dow Jones Industrial just closed above 29,000! You are so lucky to have me as your President😉With Joe Hiden’ it would crash😧”",https://www.reddit.com/r/wallstreetbets/comments/ilghvj/donnie_pumps_on_twitter_the_dow_jones_industrial/,2020-09-02 21:53:48
1599069914,Salesforce is the ultimate stock to own during the tech bubble,https://www.reddit.com/r/wallstreetbets/comments/ilbyx7/salesforce_is_the_ultimate_stock_to_own_during/,2020-09-02 18:05:14
1599027156,"The pros are getting ready for a market crash — retail investors, not so much, top economist warns",https://www.reddit.com/r/wallstreetbets/comments/il1hjq/the_pros_are_getting_ready_for_a_market_crash/,2020-09-02 06:12:36
1598955025,Why is the Dow Jones diverging significantly from the SPX?,https://www.reddit.com/r/wallstreetbets/comments/ikhmh7/why_is_the_dow_jones_diverging_significantly_from/,2020-09-01 10:10:25
1598910275,Market and Options Summary for August 31st -,https://www.reddit.com/r/wallstreetbets/comments/ik7bz6/market_and_options_summary_for_august_31st/,2020-08-31 21:44:35
1598650210,Daily Market and Options Summary for Aug-28-2020,https://www.reddit.com/r/wallstreetbets/comments/iifzr6/daily_market_and_options_summary_for_aug282020/,2020-08-28 21:30:10
1598304699,"SalesForce, Amgen and Honeywell tk John the Dow Jones Industrial Aceragr Effective Monday August 31st.",https://www.reddit.com/r/wallstreetbets/comments/ifye4o/salesforce_amgen_and_honeywell_tk_john_the_dow/,2020-08-24 21:31:39
1598302296,Daily Market and Options Summary for Aug-24-2020,https://www.reddit.com/r/wallstreetbets/comments/ifxkix/daily_market_and_options_summary_for_aug242020/,2020-08-24 20:51:36
1598291854,"""Self Directed Autist Investors"" - Is this the top? Probably not.",https://www.reddit.com/r/wallstreetbets/comments/ifu2xx/self_directed_autist_investors_is_this_the_top/,2020-08-24 17:57:34
1598269856,ASTROLOGY: new phase starts for dow jones,https://www.reddit.com/r/wallstreetbets/comments/ifnhha/astrology_new_phase_starts_for_dow_jones/,2020-08-24 11:50:56
1598046570,Daily Market and Options Summary for Aug-21-2020,https://www.reddit.com/r/wallstreetbets/comments/ie6480/daily_market_and_options_summary_for_aug212020/,2020-08-21 21:49:30
1597800776,Daily Market and Options Summary for Aug-18-2020,https://www.reddit.com/r/wallstreetbets/comments/icecdo/daily_market_and_options_summary_for_aug182020/,2020-08-19 01:32:56
1597687973,If the Indexes Were a Family,https://www.reddit.com/r/wallstreetbets/comments/ibjhkn/if_the_indexes_were_a_family/,2020-08-17 18:12:53
1597598347,General Question on the three mayor indices--,https://www.reddit.com/r/wallstreetbets/comments/iaw9m3/general_question_on_the_three_mayor_indices/,2020-08-16 17:19:07
1597495790,Noob Question,https://www.reddit.com/r/wallstreetbets/comments/ia6s3w/noob_question/,2020-08-15 12:49:50
1597280406,"S&amp;P 500 rallies, closes just shy of its record closing high - a pandemic every year would be great!",https://www.reddit.com/r/wallstreetbets/comments/i8qabn/sp_500_rallies_closes_just_shy_of_its_record/,2020-08-13 01:00:06
1597147204,(PDF) A hypothesis that the Federal Reserve can set interest rates based on the movements of the planet Mars. Here I have data going back to 1896 that shows how the Dow Jones performed when Mars was within 30 degrees of the lunar node. (- from appendix of Ares Le Mandat 4th ed) | Anthony Moore,https://www.academia.edu/42243993/A_hypothesis_that_the_Federal_Reserve_can_set_interest_rates_based_on_the_movements_of_the_planet_Mars_Here_I_have_data_going_back_to_1896_that_shows_how_the_Dow_Jones_performed_when_Mars_was_within_30_degrees_of_the_lunar_node_from_appendix_of_Ares_Le_Mandat_4th_ed_,2020-08-11 12:00:04
1597138144,A hypothesis that the Federal Reserve can set interest rates based on the movements of the planet Mars. Here I have data going back to 1896 that shows how the Dow Jones performed when Mars was within 30 degrees of the lunar node.,https://www.reddit.com/r/wallstreetbets/comments/i7oopy/a_hypothesis_that_the_federal_reserve_can_set/,2020-08-11 09:29:04
1597069638,Data going back to 1896 that shows how the Dow Jones performed when Mars was within 30 degrees of the lunar node.,https://www.reddit.com/r/wallstreetbets/comments/i75spo/data_going_back_to_1896_that_shows_how_the_dow/,2020-08-10 14:27:18
1596889854,2020 results of applying the stock market prediction algorithm outlined in Chapter 25 &amp; 48 of Ares Le Mandat,https://www.reddit.com/r/wallstreetbets/comments/i5ybxk/2020_results_of_applying_the_stock_market/,2020-08-08 12:30:54
1596833488,Daily Market and Options Summary for Aug-07-2020,https://www.reddit.com/r/wallstreetbets/comments/i5lv2u/daily_market_and_options_summary_for_aug072020/,2020-08-07 20:51:28
1596803854,A hypothesis that the Federal Reserve can set interest rates based on the movements of the planet Mars,https://www.reddit.com/r/wallstreetbets/comments/i5d1a2/a_hypothesis_that_the_federal_reserve_can_set/,2020-08-07 12:37:34
1596761269,A hypothesis that the Federal Reserve can set interest rates based on the movements of the planet Mars. Here is data going back to 1896 that shows how the Dow Jones performed when Mars was within 30 degrees of the lunar node.,https://www.reddit.com/r/wallstreetbets/comments/i542al/a_hypothesis_that_the_federal_reserve_can_set/,2020-08-07 00:47:49
1596674650,2020 results of applying the stock market prediction algorithm outlined in Chapter 25 &amp; 48 of Ares Le Mandat,https://www.reddit.com/r/wallstreetbets/comments/i4hods/2020_results_of_applying_the_stock_market/,2020-08-06 00:44:10
1596661627,Daily Market and Options Summary for Aug-05-2020,https://www.reddit.com/r/wallstreetbets/comments/i4dvwy/daily_market_and_options_summary_for_aug052020/,2020-08-05 21:07:07
1596642956,Historical data - Need help [cross post from r/stocks],https://www.reddit.com/r/wallstreetbets/comments/i47vz4/historical_data_need_help_cross_post_from_rstocks/,2020-08-05 15:55:56
1596543914,A hypothesis that the Federal Reserve can set interest rates based on the movements of the planet Mars. Here I have data going back to 1896 that shows how the Dow Jones performed when Mars was within 30 degrees of the lunar node.,https://zenodo.org/record/3711110#.XylTbChKjIU,2020-08-04 12:25:14
1596463675,A hypothesis that the Federal Reserve can set interest rates based on the movements of the planet Mars. Here Is data going back to 1896 that shows how the Dow Jones performed when Mars was within 30 degrees of the lunar node.,https://www.reddit.com/r/wallstreetbets/comments/i2xnnr/a_hypothesis_that_the_federal_reserve_can_set/,2020-08-03 14:07:55
1596117370,"Here’s some morning coffee,",https://www.reddit.com/r/wallstreetbets/comments/i0mgsn/heres_some_morning_coffee/,2020-07-30 13:56:10
1596071211,A hypothesis that the Federal Reserve can set interest rates based on the movements of the planet Mars with data going back to 1896 that shows how the Dow Jones performed when Mars was within 30 degrees of the lunar node.,https://www.reddit.com/r/wallstreetbets/comments/i0cr5y/a_hypothesis_that_the_federal_reserve_can_set/,2020-07-30 01:06:51
1595854841,A hypothesis that the Federal Reserve can set interest rates based on the movements of the planet Mars.,https://www.reddit.com/r/wallstreetbets/comments/hyrtdt/a_hypothesis_that_the_federal_reserve_can_set/,2020-07-27 13:00:41
1595019166,Goldman Sachs,https://www.reddit.com/r/wallstreetbets/comments/ht3ocx/goldman_sachs/,2020-07-17 20:52:46
1594822094,Your morning coffee,https://www.reddit.com/r/wallstreetbets/comments/hro7i6/your_morning_coffee/,2020-07-15 14:08:14
1594303138,Here’s your morning coffee!,https://www.reddit.com/r/wallstreetbets/comments/ho3jb1/heres_your_morning_coffee/,2020-07-09 13:58:58
1594128858,Who wants some morning coffee?,https://www.reddit.com/r/wallstreetbets/comments/hmumgt/who_wants_some_morning_coffee/,2020-07-07 13:34:18
1594020168,Dow Jones crosses 200 day MA,https://www.reddit.com/r/wallstreetbets/comments/hm331o/dow_jones_crosses_200_day_ma/,2020-07-06 07:22:48
1593514546,Why bad economic data is unironically bullish,https://www.reddit.com/r/wallstreetbets/comments/hil4qj/why_bad_economic_data_is_unironically_bullish/,2020-06-30 10:55:46
1593503521,Dow Jones started the week with an increase of 580 points,http://www.economo.co.uk/dow-jones-started-the-week-with-an-increase-of-580-points/,2020-06-30 07:52:01
1593197600,Start of another crash?,https://www.reddit.com/r/wallstreetbets/comments/hgdjac/start_of_another_crash/,2020-06-26 18:53:20
1592589522,Dow Jones futures giving us an unhappy week ending,https://i.redd.it/7v8klymsow551.jpg,2020-06-19 17:58:42
1592189593,How did a teenager get 700k in leverage from Robinhood?,https://www.reddit.com/r/wallstreetbets/comments/h97l9z/how_did_a_teenager_get_700k_in_leverage_from/,2020-06-15 02:53:13
1591952867,Asia &amp; Europe Shrugs Off NA 2nd Wave Panic Selling,https://www.reddit.com/r/wallstreetbets/comments/h7hakd/asia_europe_shrugs_off_na_2nd_wave_panic_selling/,2020-06-12 09:07:47
1591924152,Interactive chart for DJIA 1929-1932. Looks like April 1930 all over again....,https://www.reddit.com/r/wallstreetbets/comments/h7ay00/interactive_chart_for_djia_19291932_looks_like/,2020-06-12 01:09:12
1591460166,"Wall Street Week Ahead for the trading week beginning June 8th, 2020",https://www.reddit.com/r/wallstreetbets/comments/gxttxj/wall_street_week_ahead_for_the_trading_week/,2020-06-06 16:16:06
1591289424,I am pushing the Dow Jones to new highs,https://www.reddit.com/r/wallstreetbets/comments/gwl6r6/i_am_pushing_the_dow_jones_to_new_highs/,2020-06-04 16:50:24
1591278855,You guys all look at the wrong index (S&amp;P 500 vs Dow Jones),https://www.reddit.com/r/wallstreetbets/comments/gwhv9h/you_guys_all_look_at_the_wrong_index_sp_500_vs/,2020-06-04 13:54:15
1591200605,A hypothesis that the Federal Reserve can set interest rates based on the movements of the planet Mars. Here I have data going back to 1896 that shows how the Dow Jones performed when Mars was within 30 degrees of the lunar node. (- from appendix of Ares Le Mandat 4th ed),https://www.reddit.com/r/wallstreetbets/comments/gvwsf6/a_hypothesis_that_the_federal_reserve_can_set/,2020-06-03 16:10:05
1591143272,Get Dow Jones Up!,https://v.redd.it/vfaabvmb8l251,2020-06-03 00:14:32
1591032790,The GAP DD,https://www.reddit.com/r/wallstreetbets/comments/guox0r/the_gap_dd/,2020-06-01 17:33:10
1590884857,Thoughts on NWSA?,https://www.reddit.com/r/wallstreetbets/comments/gtp88y/thoughts_on_nwsa/,2020-05-31 00:27:37
1590582939,Dow Jones today vs. Dow Jones in 1929 Great Depression,https://i.redd.it/ryb1mmy6ya151.jpg,2020-05-27 12:35:39
